50|2021|546979.0|MAGDALENA-SANTA MARTA|197991.85199999998|4790.070000000001|2044|INTERASEO S.A.S.  E.S.P.|MAGDALENA|SANTA MARTA|PARQUE AMBIENTAL PALANGANA|20547001|2004-07-19|Relleno sanitario|-742033000|114316000.0|"28|EMPRESA OPERADORA"|"44|CORPORACIÓN AUTÓNOMA REGIONAL DEL MAGDALENA - CORPOMAG"|Licencia ambiental|1581|2000-11-17|2022-07-01|2028-07-19|2022-06-25|6.0|0.0|"44|CORPORACIÓN AUTÓNOMA REGIONAL DEL MAGDALENA - CORPOMAG"|205|2016-02-05|2021-02-05|2016-04-01|2016-06-14|0.023621780249227547
51|2021||ANTIOQUIA-CANASGORDAS|||23528|EMPRESAS PUBLICAS DE CAÑASGORDAS S.A.  E.S.P|ANTIOQUIA|CANASGORDAS|RECICLIN|637105138|2001-10-22|celda transitoria|-760653330|-30000000.0|"29|MUNICIPIO"|"65|CORPORACIÓN PARA EL DESARROLLO SOSTENIBLE DEL URABÁ ¿ CORPOURABA"|Aprobacion PMA|200-03-50-04-0503-2015|2015-11-03|2020-11-03|2020-11-03|2022-06-25|0.0|95918.0|"65|CORPORACIÓN PARA EL DESARROLLO SOSTENIBLE DEL URABÁ ¿ CORPOURABA"|30-01-25-0039|2015-12-17|2020-12-17|2016-01-01|2017-08-03|0.0
52|2021|480803.0|RISARALDA-PEREIRA|169701.16799999998|3323.5299999999997|21670|ATESA DE OCCIDENTE S.A.S  E.S.P.|RISARALDA|PEREIRA|LA GLORITA|22166001|1997-04-10|Relleno sanitario|-757978000|48530000.0|"28|EMPRESA OPERADORA"|"45|CORPORACIÓN AUTÓNOMA REGIONAL DE RISARALDA - CARDER"|Aprobacion PMA|216|2000-03-02|2025-02-18|2025-03-18|2022-06-25|2.0|3130489.0|"45|CORPORACIÓN AUTÓNOMA REGIONAL DE RISARALDA - CARDER"|2883|2010-09-10|2020-12-03|2016-04-01|2016-06-14|0.019208413818471166
53|2021||ANTIOQUIA-CARAMANTA|||26545|EMPRESAS PUBLICAS DE CARAMANTA S.A.S. E.S.P.|ANTIOQUIA|CARAMANTA|RELLENO SANITARIO EL JARDIN|652705145|2003-05-30|Relleno sanitario|-756365140|55561180.0|"29|MUNICIPIO"|"53|CORPORACIÓN AUTÓNOMA REGIONAL DEL CENTRO DE ANTIOQUIA -  CORANTIOQUIA"|Licencia ambiental|130CA-2446|2003-05-30|2020-10-28|2020-10-28|2022-06-25|0.0|1705000.0|"53|CORPORACIÓN AUTÓNOMA REGIONAL DEL CENTRO DE ANTIOQUIA -  CORANTIOQUIA"|CA14108896|2014-10-28|2020-10-28|2016-01-01|2017-08-17|0.0
54|2021||ANTIOQUIA-COCORNA|||2514|EMPRESA DE SERVICIOS PUBLICOS DE COCORNA E.S.P.|ANTIOQUIA|COCORNA|RELLENO SANITARIO DE COCORNA|803605197|1997-12-22|Relleno sanitario|-670000000|60326010.0|"29|MUNICIPIO"|"41|CORPORACIÓN AUTÓNOMA REGIONAL DE LOS RÍOS NEGRO Y NARE - CORNARE"|Licencia ambiental|112 - 3164|2007-06-29|2016-12-12|2016-12-12|2022-06-25|0.0|540000.0|"41|CORPORACIÓN AUTÓNOMA REGIONAL DE LOS RÍOS NEGRO Y NARE - CORNARE"|112-  3164|2007-06-12|2016-12-12|2016-01-01|2017-12-21|0.0
55|2021||PUTUMAYO-PUERTO ASIS|||734|EMPRESA DE ACUEDUCTO ALCANTARILLADO Y ASEO DE PUERTO ASIS E.S.P.|PUTUMAYO|PUERTO ASIS|KILILI|673286568|1990-05-12|celda de contingencia|-762929630|-0.32131|"29|MUNICIPIO"|"65|CORPORACIÓN PARA EL DESARROLLO SOSTENIBLE DEL URABÁ ¿ CORPOURABA"|otro tipo de acto administrativo|383|2015-05-27|2020-12-31|2020-12-31|2022-06-25|0.0|6120.0|"47|CORPORACIÓN PARA EL DESARROLLO SOSTENIBLE DEL SUR DE LA AMAZONIA - CORPOAMAZONIA"|1125|2016-04-24|2020-12-31|2016-05-01|2017-08-25|0.0
56|2021||ANTIOQUIA-CONCEPCION|||1818|MUNICIPIO DE CONCEPCION|ANTIOQUIA|CONCEPCION|RELLENO SANITARIO CERRO DE LA VIRGEN|966505206|1993-01-01|Relleno sanitario|-752526020|63830000.0|"29|MUNICIPIO"|"41|CORPORACIÓN AUTÓNOMA REGIONAL DE LOS RÍOS NEGRO Y NARE - CORNARE"|otro tipo de acto administrativo|5917|1999-12-04|2027-12-04|2027-12-04|2022-06-25|5.0|37188.0|"92|NO CUENTA CON PERMISO DE VERTIMIENTO DE LIXIVIADOS"||||2016-01-01|2018-07-04|0.0
57|2021||ANTIOQUIA-CONCORDIA|||1863|EMPRESAS PÚBLICAS MUNICIPALES DE CONCORDIA E.S.P.|ANTIOQUIA|CONCORDIA|RELLENO SANITARIO CONCORDIA|2783605209|2002-10-01|Relleno sanitario|-755442000|60315000.0|"29|MUNICIPIO"|"53|CORPORACIÓN AUTÓNOMA REGIONAL DEL CENTRO DE ANTIOQUIA -  CORANTIOQUIA"|Licencia ambiental|160CI-RES1807-4057|2018-07-26|2022-11-25|2022-11-26|2022-06-25|0.0|7987.0|"92|NO CUENTA CON PERMISO DE VERTIMIENTO DE LIXIVIADOS"||||2019-12-01|2022-03-17|0.0
58|2021||ANTIOQUIA-DABEIBA|||23421|EMPRESAS PUBLICAS DE DABEIBA S.A.S   E.S.P        |ANTIOQUIA|DABEIBA|RELLENO SANITARIO DE DABEIBA|1347605234|2015-12-01|Relleno sanitario|-761419000|61903300.0|"29|MUNICIPIO"|"75|NO CUENTA CON PERMISO AMBIENTAL"||||||2022-06-25||9642.0|"92|NO CUENTA CON PERMISO DE VERTIMIENTO DE LIXIVIADOS"||||2019-06-01|2019-09-21|0.0
59|2021||ANTIOQUIA-ENTRERRIOS|||20002|UNIDAD DE SERVICIOS PÚBLICOS DEL MUNICIPIO DE ENTRERRIOS|ANTIOQUIA|ENTRERRIOS|RELLENO SANITARIO ENTRERRIOS|204105264|1998-08-28|Relleno sanitario|-755200000|65653000.0|"29|MUNICIPIO"|"53|CORPORACIÓN AUTÓNOMA REGIONAL DEL CENTRO DE ANTIOQUIA -  CORANTIOQUIA"|Licencia ambiental|130TH-3782|2005-02-18|2017-02-18|2017-02-18|2022-06-25|0.0|18353.9|"53|CORPORACIÓN AUTÓNOMA REGIONAL DEL CENTRO DE ANTIOQUIA -  CORANTIOQUIA"|130TH-3782|2005-02-18|2017-02-18|2016-04-01|2016-09-02|0.0
60|2021||AMAZONAS-LETICIA|||23478|ALCALDIA DE LETICIA|AMAZONAS|LETICIA|RELLENO SANITARIO LETICIA|394291001|2015-08-29|Relleno sanitario|-699930800|-39999999.0|"29|MUNICIPIO"|"47|CORPORACIÓN PARA EL DESARROLLO SOSTENIBLE DEL SUR DE LA AMAZONIA - CORPOAMAZONIA"|Licencia ambiental|178|2015-08-06|2016-12-30|2039-05-06|2022-06-25|16.0|11009.0|"47|CORPORACIÓN PARA EL DESARROLLO SOSTENIBLE DEL SUR DE LA AMAZONIA - CORPOAMAZONIA"|390|2013-05-10|2016-12-30|2016-01-01|2017-01-31|0.0
61|2021||ANTIOQUIA-FRONTINO|||793|EMPRESA DE SERVICIOS PUBLICOS  DE FRONTINO E.S.P. FRONTINO|ANTIOQUIA|FRONTINO|PARQUE DE APROVECHAMIENTO DE RESIDUOS SOLIDOS LA ESPERANZA|960005284|2013-06-08|Relleno sanitario|-761180553|68064444.0|"29|MUNICIPIO"|"65|CORPORACIÓN PARA EL DESARROLLO SOSTENIBLE DEL URABÁ ¿ CORPOURABA"|Licencia ambiental|200-03-20-02-0649-2010|2010-05-20|2038-06-08|2038-06-08|2022-06-25|15.0|1.5664e+16|"65|CORPORACIÓN PARA EL DESARROLLO SOSTENIBLE DEL URABÁ ¿ CORPOURABA"|200-03-20-02-0649-2010|2010-05-20|2038-06-08|2016-01-01|2018-06-27|0.0
62|2021||ANTIOQUIA-GIRALDO|||25524|EMPRESA DE SERVICIOS PUBLICOS DOMICILIARIOS DE GIRALDO S.A. E.S.P |ANTIOQUIA|GIRALDO|GIRALDO|2474705306|2010-06-10|botadero a cielo abierto|-759470560|66747220.0|"29|MUNICIPIO"|"65|CORPORACIÓN PARA EL DESARROLLO SOSTENIBLE DEL URABÁ ¿ CORPOURABA"|Licencia ambiental|200-03-20-02-0652-2010|2010-05-05|2022-12-30|2022-12-30|2022-06-25|0.0|15000.0|"65|CORPORACIÓN PARA EL DESARROLLO SOSTENIBLE DEL URABÁ ¿ CORPOURABA"|200-03-20-02-0652-2010|2010-05-05|2022-12-30|2016-01-01|2021-10-08|0.0
63|2021|59755.0|PUTUMAYO-MOCOA|9140.92|0.0|28511|EMPRESA METROPOLITANA DE ASEO DEL PUTUMAYO S.A.S. E.S.P.|PUTUMAYO|MOCOA|RELLENO SANITARIO VEREDA MEDIO AFAN|570586001|2015-02-01|Relleno sanitario|-763800284|11038698.0|"29|MUNICIPIO"|"47|CORPORACIÓN PARA EL DESARROLLO SOSTENIBLE DEL SUR DE LA AMAZONIA - CORPOAMAZONIA"|Licencia ambiental|696|2018-06-06|2043-09-09|2043-09-09|2022-06-25|21.0|657000.0|"47|CORPORACIÓN PARA EL DESARROLLO SOSTENIBLE DEL SUR DE LA AMAZONIA - CORPOAMAZONIA"|696|2018-06-06|2043-09-09|2016-04-01|2019-11-22|0.0
64|2021||CAQUETA-SAN VICENTE DEL CAGUAN|||31893|SOLUCIONES AMBIENTALES INTEGRALES DE LA AMAZONIA S.A. E.S.P.|CAQUETA|SAN VICENTE DEL CAGUAN|RELLENO SANITARIO YOTUEL|1098418753|2013-12-06|Relleno sanitario|-748425000|20748611.0|"28|EMPRESA OPERADORA"|"47|CORPORACIÓN PARA EL DESARROLLO SOSTENIBLE DEL SUR DE LA AMAZONIA - CORPOAMAZONIA"|Licencia ambiental|2|2012-01-12|2036-02-28|2036-02-28|2022-06-25|13.0|159870.0|"47|CORPORACIÓN PARA EL DESARROLLO SOSTENIBLE DEL SUR DE LA AMAZONIA - CORPOAMAZONIA"|2|2012-01-12|2036-02-28|2016-04-01|2018-12-12|0.0
65|2021||ANTIOQUIA-GRANADA|||2356|EMPRESA DE SERVICIOS PÚBLICOS DE GRANADA|ANTIOQUIA|GRANADA|GRANADA|1321505313|2010-12-29|Relleno sanitario|-751645920|61471970.0|"29|MUNICIPIO"|"41|CORPORACIÓN AUTÓNOMA REGIONAL DE LOS RÍOS NEGRO Y NARE - CORNARE"|Licencia ambiental|112-8091|2010-12-29|2030-12-29|2030-12-29|2022-06-25|8.0|38275.0|"41|CORPORACIÓN AUTÓNOMA REGIONAL DE LOS RÍOS NEGRO Y NARE - CORNARE"|112-1183|2018-03-12|2030-12-29|2018-11-01|2019-08-21|0.0
66|2021||ANTIOQUIA-GUATAPE|||1149|EMPRESA DE SERVICIOS  PUBLICOS DE GUATAPE S.A.S E.S.P|ANTIOQUIA|GUATAPE|RELLENO SANITARIO MIRAFLORES|2580905321|1999-09-07|Relleno sanitario|-758833330|64666660.0|"29|MUNICIPIO"|"41|CORPORACIÓN AUTÓNOMA REGIONAL DE LOS RÍOS NEGRO Y NARE - CORNARE"|Licencia ambiental|4110|1999-09-07|2030-12-31|2030-12-31|2022-06-25|8.0|200000.0|"41|CORPORACIÓN AUTÓNOMA REGIONAL DE LOS RÍOS NEGRO Y NARE - CORNARE"|132-0001|2015-01-21|2025-01-20|2016-04-30|2021-11-25|0.0
67|2021||ANTIOQUIA-LA UNION|||91|EMPRESA DE SERVICIOS PUBLICOS LA UNION S.A E.S.P.|ANTIOQUIA|LA UNION|RELLENO SANITARIO BUENA VISTA|2664905400|1991-08-25|Relleno sanitario|-753500000|59500000.0|"29|MUNICIPIO"|"41|CORPORACIÓN AUTÓNOMA REGIONAL DE LOS RÍOS NEGRO Y NARE - CORNARE"|Aprobacion PMA|112-3538|2009-07-28|2036-07-28|2036-07-28|2022-06-25|14.0|44886.0|"41|CORPORACIÓN AUTÓNOMA REGIONAL DE LOS RÍOS NEGRO Y NARE - CORNARE"|131-0699|2015-10-19|2036-10-19|2016-04-29|2022-01-19|0.0
68|2021||ANTIOQUIA-MACEO|||23336|EMPRESA DE SERVICIOS PUBLICOS DE MACEO S.A.S  E.S.P.|ANTIOQUIA|MACEO|TINAJAS|2241805425|2010-04-01|Relleno sanitario|-748178783|65844363.0|"28|EMPRESA OPERADORA"|"53|CORPORACIÓN AUTÓNOMA REGIONAL DEL CENTRO DE ANTIOQUIA -  CORANTIOQUIA"|Licencia ambiental|130ZF2478|2006-11-21|2036-11-21|2040-11-21|2022-06-25|18.0|9699000000000000.0|"53|CORPORACIÓN AUTÓNOMA REGIONAL DEL CENTRO DE ANTIOQUIA -  CORANTIOQUIA"|130ZF2478|2006-11-21|2036-11-21|2016-01-01|2021-06-24|0.0
69|2021||ANTIOQUIA-PENOL|||794|AGUAS Y ASEO DE EL PEÑOL E.S.P.|ANTIOQUIA|PENOL|LAS HOYERAS|2633605541|2002-07-26|Relleno sanitario|-759500000|65166670.0|"29|MUNICIPIO"|"41|CORPORACIÓN AUTÓNOMA REGIONAL DE LOS RÍOS NEGRO Y NARE - CORNARE"|Licencia ambiental|2501|2002-07-26|2034-12-31|2034-12-31|2022-06-25|12.0|90093.0|"92|NO CUENTA CON PERMISO DE VERTIMIENTO DE LIXIVIADOS"||||2016-04-30|2021-12-22|0.0
70|2021||ANTIOQUIA-PEQUE|||26547|EMPRESA DE SERVICIOS PUBLICOS DOMICILIARIOS DEL MUNICIPIO DE PEQUE ANTIOQUIA S.A E.S.P |ANTIOQUIA|PEQUE|LA GRANJA|797505543|1990-08-01|botadero a cielo abierto|-750913500|70221944.0|"29|MUNICIPIO"|"75|NO CUENTA CON PERMISO AMBIENTAL"||||||2022-06-25||3363.0|"92|NO CUENTA CON PERMISO DE VERTIMIENTO DE LIXIVIADOS"||||2016-01-01|2017-12-12|0.0
71|2021||ANTIOQUIA-PUERTO BERRIO|||2150|AGUAS DEL PUERTO S.A E.S.P|ANTIOQUIA|PUERTO BERRIO|LA TABACA|625405579|2006-02-01|Relleno sanitario|-744596580|65502300.0|"31|OTRA PERSONA NATURAL O JURIDICA"|"53|CORPORACIÓN AUTÓNOMA REGIONAL DEL CENTRO DE ANTIOQUIA -  CORANTIOQUIA"|Licencia ambiental|130ZF-4111|2010-09-08|2021-09-02|2027-09-02|2022-06-25|5.0|347294.0|"53|CORPORACIÓN AUTÓNOMA REGIONAL DEL CENTRO DE ANTIOQUIA -  CORANTIOQUIA"|130ZF-4111|2010-09-02|2021-09-02|2016-04-30|2017-07-27|0.0
72|2021||ANTIOQUIA-REMEDIOS|||30011|AGUAS Y SERVICIOS DEL ITE  S.A.S   E.S.P.|ANTIOQUIA|REMEDIOS|PARQUE AMBIENTAL PARAJE PUENTE ROTO|2246805604|2014-04-10|Relleno sanitario|-746834784|70207764.0|"29|MUNICIPIO"|"53|CORPORACIÓN AUTÓNOMA REGIONAL DEL CENTRO DE ANTIOQUIA -  CORANTIOQUIA"|Licencia ambiental|13OZF-15016940|2015-01-08|2018-04-10|2026-03-01|2022-06-25|3.0|54322.0|"53|CORPORACIÓN AUTÓNOMA REGIONAL DEL CENTRO DE ANTIOQUIA -  CORANTIOQUIA"|13OZF-15016940|2015-01-08|2018-04-10|2019-11-20|2021-06-25|0.0
73|2021||ANTIOQUIA-SABANALARGA|||22745|EMPRESA DE SERVICIOS PUBLICOS DOMICILIAMRIOS DEL MUNICIPIO DE SABANALARGA S.A E.S.P |ANTIOQUIA|SABANALARGA|PARQUE AMBIENTAL Y ECOLOGICO EL JUNQUITO|1832705628|2000-10-02|Relleno sanitario|-754827000|65118000.0|"29|MUNICIPIO"|"53|CORPORACIÓN AUTÓNOMA REGIONAL DEL CENTRO DE ANTIOQUIA -  CORANTIOQUIA"|Licencia ambiental|130HX-1307-6659|2013-07-31|2023-07-31|2023-07-31|2022-06-25|1.0|4446.0|"53|CORPORACIÓN AUTÓNOMA REGIONAL DEL CENTRO DE ANTIOQUIA -  CORANTIOQUIA"|130HX-1307-6659|2013-07-31|2023-07-31|2019-01-01|2020-12-08|0.0
74|2021|39990.0|ANTIOQUIA-SEGOVIA|14436.7|0.0|21861|SEGOVIA ASEO S.A.  E.S.P.|ANTIOQUIA|SEGOVIA|LA VERA|833805736|2007-08-15|Relleno sanitario|-747130000|70810000.0|"29|MUNICIPIO"|"53|CORPORACIÓN AUTÓNOMA REGIONAL DEL CENTRO DE ANTIOQUIA -  CORANTIOQUIA"|Licencia ambiental|9900204|1999-12-06|2017-12-06|2017-12-06|2022-06-25|0.0|98280.0|"53|CORPORACIÓN AUTÓNOMA REGIONAL DEL CENTRO DE ANTIOQUIA -  CORANTIOQUIA"|9900204|1999-12-06|2017-12-06|2017-12-06|2018-02-19|0.0
75|2021||ANTIOQUIA-SAN ANDRES DE CUERQUIA|||23363|EMPRESAS PUBLICAS DE SAN ANDRES DE CUERQUIA SA ESP|ANTIOQUIA|SAN ANDRES DE CUERQUIA|AGUAS VIVAS|2410005647|2002-03-12|Relleno sanitario|-750000000|60000000.0|"29|MUNICIPIO"|"53|CORPORACIÓN AUTÓNOMA REGIONAL DEL CENTRO DE ANTIOQUIA -  CORANTIOQUIA"|Licencia ambiental|130TH-4307|2002-03-12|2020-03-08|2020-03-08|2022-06-25|0.0|20000.0|"92|NO CUENTA CON PERMISO DE VERTIMIENTO DE LIXIVIADOS"||||2016-04-01|2021-09-02|0.0
76|2021||ANTIOQUIA-SAN CARLOS|||20109|UNIDAD DE SERVICIOS PUBLICOS DOMICILIARIOS DEL MUNICIPIO DE SAN CARLOS AGUAS Y ASEO DEL TABOR|ANTIOQUIA|SAN CARLOS|EL CAIMO|625705649|1990-03-21|Relleno sanitario|-749559550|61949980.0|"29|MUNICIPIO"|"41|CORPORACIÓN AUTÓNOMA REGIONAL DE LOS RÍOS NEGRO Y NARE - CORNARE"|Licencia ambiental|2139|1999-05-14|2018-12-31|2018-12-31|2022-06-25|0.0|176901.0|"41|CORPORACIÓN AUTÓNOMA REGIONAL DE LOS RÍOS NEGRO Y NARE - CORNARE"|2139|1999-05-14|2018-12-31|2016-07-19|2017-07-28|0.0
77|2021||ANTIOQUIA-SAN FRANCISCO|||26742|EMPRESA DE SERVICIOS PUBLICOS DE SAN FRANCISCO ANTIOQUIA SAS ESP|ANTIOQUIA|SAN FRANCISCO|EL PAJUI|644205652|2013-10-01|Relleno sanitario|-756712000|55755000.0|"29|MUNICIPIO"|"41|CORPORACIÓN AUTÓNOMA REGIONAL DE LOS RÍOS NEGRO Y NARE - CORNARE"|Licencia ambiental|112-0479|2010-11-03|2018-01-03|2018-01-03|2022-06-25|0.0|2.441e+16|"92|NO CUENTA CON PERMISO DE VERTIMIENTO DE LIXIVIADOS"||||2017-01-01|2017-08-10|0.0
78|2021||ANTIOQUIA-SAN JOSE DE LA MONTANA|||706|UNIDAD DE SERVICIOS PUBLICOS DOMICILIARIOS DEL MUNICIPIO DE SAN JOSE DE LA MONTAÑA|ANTIOQUIA|SAN JOSE DE LA MONTANA|LOS ROBLES|623705658|2004-01-04|Relleno sanitario|-668583010|137571470.0|"29|MUNICIPIO"|"53|CORPORACIÓN AUTÓNOMA REGIONAL DEL CENTRO DE ANTIOQUIA -  CORANTIOQUIA"|Licencia ambiental|2843|2003-12-10|2022-12-10|2024-12-10|2022-06-25|2.0|50000.0|"53|CORPORACIÓN AUTÓNOMA REGIONAL DEL CENTRO DE ANTIOQUIA -  CORANTIOQUIA"|1104-8263|2011-04-15|2022-04-15|2016-08-10|2017-07-26|0.0
79|2021||ANTIOQUIA-SAN LUIS|||26072|EMPRESAS PUBLICAS DE SAN LUIS S.A.S. E.S.P.|ANTIOQUIA|SAN LUIS|SAN FRANCISCO|1335305660|2013-08-27|Relleno sanitario|-750073600|60486380.0|"29|MUNICIPIO"|"41|CORPORACIÓN AUTÓNOMA REGIONAL DE LOS RÍOS NEGRO Y NARE - CORNARE"|Licencia ambiental|1123265|2013-08-27|2025-08-26|2025-08-26|2022-06-25|3.0|19907.0|"41|CORPORACIÓN AUTÓNOMA REGIONAL DE LOS RÍOS NEGRO Y NARE - CORNARE"|1123265|2013-08-27|2025-08-26|2016-01-01|2019-09-06|0.0
80|2021||ANTIOQUIA-SAN VICENTE FERRER|||1405|SECRETARIA DE SERVICIOS PUBLICOS MUNICIPIO DE SAN VICENTE |ANTIOQUIA|SAN VICENTE FERRER|GRANJA EXPERIMENTAL DE RESIDUOS SOLIDOS|994005674|1993-01-01|Relleno sanitario|-751956000|61655000.0|"29|MUNICIPIO"|"41|CORPORACIÓN AUTÓNOMA REGIONAL DE LOS RÍOS NEGRO Y NARE - CORNARE"|Licencia ambiental|112-5337|2003-02-27|2024-02-27|2024-02-27|2022-06-25|1.0|27317.0|"92|NO CUENTA CON PERMISO DE VERTIMIENTO DE LIXIVIADOS"||||2016-04-01|2018-08-06|0.0
81|2021||ANTIOQUIA-TAMESIS|||26842|EMPRESA DE SERVICIOS PUBLICOS DOMICILIARIOS TAMESIS ESP SAS|ANTIOQUIA|TAMESIS|SANTA TERESA|2544905789|2002-12-31|Relleno sanitario|-762906660|61183330.0|"29|MUNICIPIO"|"53|CORPORACIÓN AUTÓNOMA REGIONAL DEL CENTRO DE ANTIOQUIA -  CORANTIOQUIA"|Licencia ambiental|160-CA-15069407|2015-06-23|2021-08-28|2024-12-31|2022-06-25|2.0|14091.0|"92|NO CUENTA CON PERMISO DE VERTIMIENTO DE LIXIVIADOS"||||2016-04-30|2021-11-09|0.0
82|2021|44885.0|ANTIOQUIA-ANDES|4137.0|0.0|26991|EMPRESA DE SERVICIOS PUBLICOS DE ANDES S.A E.S.P|ANTIOQUIA|ANDES|ALTO DEL RAYO|1206505034|2014-07-01|Relleno sanitario|-758896500|56874500.0|"29|MUNICIPIO"|"53|CORPORACIÓN AUTÓNOMA REGIONAL DEL CENTRO DE ANTIOQUIA -  CORANTIOQUIA"|Licencia ambiental|140810974|2014-08-15|2017-08-14|2017-08-14|2022-06-25|0.0|40797.0|"53|CORPORACIÓN AUTÓNOMA REGIONAL DEL CENTRO DE ANTIOQUIA -  CORANTIOQUIA"|140810974|2014-08-15|2017-08-14|2016-04-16|2019-04-24|0.0
83|2021||ANTIOQUIA-TARSO|||22823|EMPRESA DE SERVICIOS PUBLICOS DE TARSO S.A. E.S.P.|ANTIOQUIA|TARSO|LOS GUAYACANES|2815005792|2011-04-07|Relleno sanitario|-754908000|55070000.0|"31|OTRA PERSONA NATURAL O JURIDICA"|"53|CORPORACIÓN AUTÓNOMA REGIONAL DEL CENTRO DE ANTIOQUIA -  CORANTIOQUIA"|Licencia ambiental|130 CA-11046662|2011-04-07|2029-04-07|2031-04-07|2022-06-25|8.0|8434.0|"92|NO CUENTA CON PERMISO DE VERTIMIENTO DE LIXIVIADOS"||||2021-06-01|2022-04-05|0.0
84|2021||ANTIOQUIA-YALI|||22948|SERVICIOS PUBLICOS YALÍ S.A. E.S.P.|ANTIOQUIA|YALI|LA AURORA|1224705885|2009-08-20|Relleno sanitario|-748565720|66832820.0|"29|MUNICIPIO"|"53|CORPORACIÓN AUTÓNOMA REGIONAL DEL CENTRO DE ANTIOQUIA -  CORANTIOQUIA"|Licencia ambiental|130ZF-2949|2007-11-01|2028-11-25|2028-11-25|2022-06-25|6.0|36059.0|"53|CORPORACIÓN AUTÓNOMA REGIONAL DEL CENTRO DE ANTIOQUIA -  CORANTIOQUIA"|130ZF-2949|2007-11-01|2028-11-25|2017-01-01|2019-05-21|0.0
85|2021|450074.0|CALDAS-MANIZALES|136677.23999999996|1715.33|626|EMPRESA METROPOLITANA DE ASEO S.A.  E.S.P.|CALDAS|MANIZALES|LA ESMERALDA MANIZALES|208117001|1995-02-16|Relleno sanitario|-755089250|50803556.0|"29|MUNICIPIO"|"54|CORPORACIÓN AUTÓNOMA REGIONAL DE CALDAS - CORPOCALDAS"|Aprobacion PMA|1348-2020|2020-09-07|2034-09-07|2034-09-07|2022-06-25|12.0|2490000.0|"54|CORPORACIÓN AUTÓNOMA REGIONAL DE CALDAS - CORPOCALDAS"|1348-2020|2020-09-07|2034-09-07|2016-04-01|2021-08-31|0.012394668297582742
86|2021|74655.0|CALDAS-LA DORADA|17619.0|145.14|3021|EMPRESA DE SERVICIOS PUBLICOS DE LA DORADA E.S.P.|CALDAS|LA DORADA|LA DORADITA|680417380|2001-08-01|Relleno sanitario|-747000000|55600000.0|"29|MUNICIPIO"|"54|CORPORACIÓN AUTÓNOMA REGIONAL DE CALDAS - CORPOCALDAS"|Licencia ambiental|491|2012-09-27|2031-09-27|2031-12-27|2022-06-25|9.0|615000.0|"54|CORPORACIÓN AUTÓNOMA REGIONAL DE CALDAS - CORPOCALDAS"|491|2012-09-27|2031-12-27|2017-01-01|2017-08-29|0.008170392712509583
87|2021||ANTIOQUIA-YONDO|||2639|AGUAS & ASEO YONDO SA ESP |ANTIOQUIA|YONDO|LAS AMERICAS|2220805893|2016-01-01|Relleno sanitario|-735542956|70353980.0|"29|MUNICIPIO"|"53|CORPORACIÓN AUTÓNOMA REGIONAL DEL CENTRO DE ANTIOQUIA -  CORANTIOQUIA"|Licencia ambiental|130FZ13115219|2013-11-12|2023-11-12|2023-12-31|2022-06-25|1.0|81147.0|"53|CORPORACIÓN AUTÓNOMA REGIONAL DEL CENTRO DE ANTIOQUIA -  CORANTIOQUIA"|13116219|2013-11-12|2023-11-12|2018-06-01|2021-06-18|0.0
88|2021|84734.0|ANTIOQUIA-CALDAS|17428.721999999998|1149.83|20521|EMPRESAS PUBLICAS DE JARDIN S.A.  E.S.P. - EPJ|ANTIOQUIA|CALDAS|LOS EUCALIPTOS ANTIOQUIA|2180705129|2007-11-01|Relleno sanitario|-750000000|60000000.0|"29|MUNICIPIO"|"54|CORPORACIÓN AUTÓNOMA REGIONAL DE CALDAS - CORPOCALDAS"|Aprobacion PMA|524|2012-10-11|2080-01-01|2080-01-01|2022-06-25|57.0|38000.0|"54|CORPORACIÓN AUTÓNOMA REGIONAL DE CALDAS - CORPOCALDAS"|0|2016-01-01|2016-12-31|2016-01-01|2021-05-29|0.06189018390668983
89|2021||ARAUCA-FORTUL|||2182|EMPRESA COMUNITARIA DE ACUEDUCTO, ALCANTARILLADO Y ASEO URBANO Y RURAL DEL MUNICIPIO DE FORTUL|ARAUCA|FORTUL|CELDA SAN PEDRO|705181300|2010-10-01|celda de contingencia|-714654570|64634880.0|"29|MUNICIPIO"|"62|CORPORACIÓN AUTÓNOMA REGIONAL DE LA ORINOQUÍA ¿ CORPORINOQUIA"|Aprobacion PMA|700.41.13-060|2013-11-14|2014-11-14|2017-06-30|2022-06-25|0.0|2250.0|"92|NO CUENTA CON PERMISO DE VERTIMIENTO DE LIXIVIADOS"||||2016-01-01|2017-09-14|0.0
90|2021||ARAUCA-PUERTO RONDON|||39774|EMPRESA DE SERVICIOS PUBLICOS DE PUERTO RONDON SAS ESP|ARAUCA|PUERTO RONDON|RELLENO SANITARIO PUERTO RONDON|2585581591|2010-03-19|Relleno sanitario|-710908000|61708000.0|"29|MUNICIPIO"|"62|CORPORACIÓN AUTÓNOMA REGIONAL DE LA ORINOQUÍA ¿ CORPORINOQUIA"|Licencia ambiental|7004110057|2010-03-19|2025-03-19|2030-03-19|2022-06-25|7.0|19652.0|"62|CORPORACIÓN AUTÓNOMA REGIONAL DE LA ORINOQUÍA ¿ CORPORINOQUIA"|7004110057|2010-03-19|2025-03-19|2016-03-17|2021-11-26|0.0
91|2021|21912.0|SANTANDER-MALAGA|3788.9599999999996|93.82|1001|EMPRESAS PUBLICAS MUNICIPALES DE MALAGA  E.S.P.|SANTANDER|MALAGA|PTRSMALAGA|1104468432|2003-12-29|Relleno sanitario|-727294000|67245400.0|"29|MUNICIPIO"|"55|CORPORACIÓN AUTÓNOMA REGIONAL DE SANTANDER - CAS"|Licencia ambiental|4866|2003-12-29|2033-12-29|2033-12-29|2022-06-25|11.0|33633.0|"55|CORPORACIÓN AUTÓNOMA REGIONAL DE SANTANDER - CAS"|4866|2003-12-29|2033-12-29|2016-04-01|2018-12-17|0.02416309963479775
92|2021||BOLIVAR-SAN JACINTO|||28811|EMPRESA PRESTADORA DEL SERVICIO PUBLICO DE ASEO DE SAN JACINTO |BOLIVAR|SAN JACINTO|RELLENO SANITARIO REGIONAL DEL SAN JACINTO|176513654|2012-11-27|Relleno sanitario|-750997350|98356670.0|"29|MUNICIPIO"|"48|CORPORACIÓN AUTÓNOMA REGIONAL DEL CANAL DEL DIQUE - CARDIQUE"|Licencia ambiental|1170|2011-10-27|2036-10-26|2036-10-26|2022-06-25|14.0|644392.0|"92|NO CUENTA CON PERMISO DE VERTIMIENTO DE LIXIVIADOS"||||2016-04-01|2016-08-23|0.0
93|2021||BOLIVAR-SIMITI|||42698|EMPRESA DE ASEO REGIONAL DEL SUR DE BOLIVAR S.A.S. E.S.P.|BOLIVAR|SIMITI|RELLENO SANITARIO REGIONAL DEL SUR DE BOLIVAR|1241513744|2018-10-01|Relleno sanitario|-739440460|78366220.0|"29|MUNICIPIO"|"66|CORPORACIÓN AUTÓNOMA REGIONAL DEL SUR DE BOLÍVAR ¿ CSB"|Licencia ambiental|224|2010-09-24|2040-09-23|2040-09-23|2022-06-25|18.0|18806.0|"66|CORPORACIÓN AUTÓNOMA REGIONAL DEL SUR DE BOLÍVAR ¿ CSB"|224|2010-09-24|2040-09-23|2018-10-01|2019-06-06|0.0
94|2021||META-GRANADA|||251|EMPRESA DE SERVICIOS PÚBLICOS DE GRANADA ESP -  META|META|GRANADA|GUARATARA|2450850313|2006-01-14|Relleno sanitario|-736876920|35664780.0|"28|EMPRESA OPERADORA"|"56|CORPORACIÓN PARA EL DESARROLLO SOSTENIBLE DEL ÁREA DE MANEJO ESPECIAL DE LA MACARENA - CORMACARENA"|Licencia ambiental|1846|2015-10-14|2016-11-03|2024-11-04|2022-06-25|2.0|246464.0|"56|CORPORACIÓN PARA EL DESARROLLO SOSTENIBLE DEL ÁREA DE MANEJO ESPECIAL DE LA MACARENA - CORMACARENA"|1846|2015-10-14|2016-11-03|2016-04-30|2021-09-27|0.0
95|2021|549922.0|META-VILLAVICENCIO|153576.05999999997|33003.8|806|BIOAGRICOLA DEL LLANO S.A  EMPRESA DE SERVICIOS PUBLICOS|META|VILLAVICENCIO|PARQUE ECOLOGICO RECICLANTE|2250001|2008-01-01|Relleno sanitario|-734418889|41270750.0|"28|EMPRESA OPERADORA"|"56|CORPORACIÓN PARA EL DESARROLLO SOSTENIBLE DEL ÁREA DE MANEJO ESPECIAL DE LA MACARENA - CORMACARENA"|Licencia ambiental|26070982|2007-12-21|2040-12-21|2040-12-21|2022-06-25|18.0|5998525.0|"56|CORPORACIÓN PARA EL DESARROLLO SOSTENIBLE DEL ÁREA DE MANEJO ESPECIAL DE LA MACARENA - CORMACARENA"|26070982|2007-12-21|2040-12-21|2016-04-01|2016-06-01|0.17688833081984306
96|2021||BOYACA-BERBEO|||21284|UNIDAD MUNICIPAL DE SERVICIOS PUBLICOS MUNICIPIO DE BERBEO|BOYACA|BERBEO|RELLENO SANITARIO PIRGUA|1447915090|2014-12-01|Relleno sanitario|-733670000|55330000.0|"28|EMPRESA OPERADORA"|"51|CORPORACIÓN AUTÓNOMA REGIONAL DE BOYACÁ - CORPOBOYACA"|Licencia ambiental|RES 052|2014-12-02|2026-12-09|2026-12-23|2022-06-25|4.0|5000.0|"51|CORPORACIÓN AUTÓNOMA REGIONAL DE BOYACÁ - CORPOBOYACA"|RES 033|2015-02-03|2025-12-17|2019-02-06|2019-12-16|0.0
97|2021|54647.0|NORTE DE SANTANDER-PAMPLONA|12121.0|700.02|739|EMPRESA DE SERVICIOS PUBLICOS DE PAMPLONA S.A. E.S.P.|NORTE DE SANTANDER|PAMPLONA|RELLENOS SANITARIO LA CORTADA|350454518|2010-07-01|Relleno sanitario|-723738880|72266440.0|"28|EMPRESA OPERADORA"|"59|CORPORACIÓN AUTONÓMA REGIONAL DE NORTE DE SANTANDER ¿ CORPONOR"|Licencia ambiental|222|2006-05-02|2026-05-02|2026-05-02|2022-06-25|3.0|172583.0|"59|CORPORACIÓN AUTONÓMA REGIONAL DE NORTE DE SANTANDER ¿ CORPONOR"|222|2006-05-02|2026-05-02|2016-09-01|2016-11-21|0.05459940004773411
98|2021||BOYACA-BUSBANZA|||2095|UNIDAD DE SERVICIOS PUBLICOS DOMICILIARIOS DE BUSBANZA|BOYACA|BUSBANZA|CELDA TRANSITORIA NUMA|789615114|2002-11-25|celda transitoria|-728338140|58305090.0|"29|MUNICIPIO"|"75|NO CUENTA CON PERMISO AMBIENTAL"||||||2022-06-25||152.0|"92|NO CUENTA CON PERMISO DE VERTIMIENTO DE LIXIVIADOS"||||2016-01-01|2017-12-04|0.0
99|2021||BOYACA-GARAGOA|||20359|EMPRESAS PUBLICAS DE GARAGOA S.A. E.S.P|BOYACA|GARAGOA|PLANTA REGIONAL DE RESIDUOS SOLIDOS|330715299|2002-05-02|Relleno sanitario|-733650460|50824530.0|"28|EMPRESA OPERADORA"|"58|CORPORACIÓN AUTÓNOMA REGIONAL DE CHIVOR ¿ CORPOCHIVOR"|Licencia ambiental|224|2002-05-02|2022-05-01|2022-05-01|2022-06-25|0.0|10535.0|"58|CORPORACIÓN AUTÓNOMA REGIONAL DE CHIVOR ¿ CORPOCHIVOR"|223|2014-04-14|2019-06-20|2016-01-01|2016-11-08|0.0
100|2021|37690.0|CASANARE-PAZ DE ARIPORO|4987.68|0.0|866|PAZ DE ARIPORO S.A.  E.S.P.|CASANARE|PAZ DE ARIPORO|EL GAVAN|2363885250|2019-11-11|Relleno sanitario|-719276528|58238528.0|"29|MUNICIPIO"|"62|CORPORACIÓN AUTÓNOMA REGIONAL DE LA ORINOQUÍA ¿ CORPORINOQUIA"|Licencia ambiental|50036181262|2018-08-24|2026-02-24|2026-02-24|2022-06-25|3.0|108892.0|"62|CORPORACIÓN AUTÓNOMA REGIONAL DE LA ORINOQUÍA ¿ CORPORINOQUIA"|500.36.18.1262|2018-08-24|2026-02-24|2019-11-11|2021-08-12|0.0
101|2021||BOYACA-SAN MIGUEL DE SEMA|||23508|ADMINISTRACION PUBLICA COOPERATIVA EMPRESA SOLIDARIA DE SERVICIOS PUBLICOS DEL MUNICIPIO DE SAN MIGUEL DE SEMA|BOYACA|SAN MIGUEL DE SEMA|SITIO DE DISPOSICION FINAL RELLENO SANITARIO|1669315676|2003-12-23|cuerpo de agua|-734322680|53308660.0|"29|MUNICIPIO"|"42|CORPORACIÓN AUTÓNOMA REGIONAL DE CUNDINAMARCA - CAR"|Licencia ambiental|1490|2003-12-23|2020-12-23|2043-12-23|2022-06-25|21.0|3174.0|"92|NO CUENTA CON PERMISO DE VERTIMIENTO DE LIXIVIADOS"||||2016-01-01|2020-08-31|0.0
